GSTIN No,PAN No,Name,Permanent Address
-NA-,,Lt. Sh. MUKHINDER SINGH,"Villette Kothi, Khalini, Shimla, Khalini, Shimla, Himachal Pradesh (171002)"
-NA-,,Lt. Sh. MUKHINDER SINGH,"Villette Kothi, Khalini, Shimla, Khalini, Shimla, Himachal Pradesh (171002)"
-NA-,,Lt. Sh. MUKHINDER SINGH,"Villette Kothi, Khalini, Shimla, Khalini, Shimla, Himachal Pradesh (171002)"
,,UMA BAGOLIA AND D KONDA,"C/o Shiv Kumar Bagolia, House No. 1155, Sector 33 C, Chandigarh, Chandigarh (160036)"
00AAAAA0000AAAA,,MS URBAN GREENS,"C/o Solutions, Near Grand Plaza Shopping Complex, Palampur, Kangra, Himachal Pradesh (176061)"
GSTIN0123456789,,M/S. JANTA LAND PROMOTERS PVT. LTD.,"SCO39-42,SECTOR -82, SAS NAGAR MOHALI, Mohali, Punjab (140306)"
